{
  "sceneId": "you-are-a-senior-intelligence-officer-summoned-to-a-sealed-conference-room-inside-a-foreign-embassy-at-night-a-junior-diplomat-has-been-caught-leaking-classified-negotiation-documents-during-a-fragile-peace-summit-the-leak-may-have-been-coerced-through-blackmail-involving-a-hidden-personal-scandal-the-building-is-under-quiet-lockdown-and-if-this-situation-becomes-public-it-could-collapse-the-treaty-talks-and-trigger-military-escalation-you-must-extract-the-truth-while-preserving-diplomatic-stability-the-diplomat-may-be-lying-panicking-or-protecting-someone-more-powerful",
  "variantId": "embassy-crisis",
  "title": "The Tipping Point",
  "intro": {
    "narration": "The air is thick with tension as you step into the dimly lit conference room. Shadows dance along the walls, and the faint hum of the building's ventilation system is the only sound. A junior diplomat sits at the table, visibly shaken, clutching a stack of documents that could unravel the fragile peace talks."
  },
  "nodes": [
    {
      "nodeId": "node1",
      "narration": "You take a seat across from the diplomat, your gaze steady. You can sense their fear, but you need to know the truth. The stakes are high, and every moment counts.",
      "choices": [
        {
          "choiceId": "choice1a",
          "text": "Calmly ask about the documents.",
          "to": "node2"
        },
        {
          "choiceId": "choice1b",
          "text": "Accuse them of leaking information.",
          "to": "node3",
          "guards": [
            "stat:trust<2"
          ]
        }
      ]
    },
    {
      "nodeId": "node2",
      "narration": "The diplomat hesitates, their eyes darting to the door. You lean in, urging them to speak. They finally admit that they were approached by someone threatening to expose a personal scandal.",
      "choices": [
        {
          "choiceId": "choice2a",
          "text": "Press for details about the threat.",
          "to": "node4"
        },
        {
          "choiceId": "choice2b",
          "text": "Reassure them of confidentiality.",
          "to": "node5",
          "effects": [
            "stat:trust+1"
          ]
        }
      ]
    },
    {
      "nodeId": "node3",
      "narration": "The accusation hangs in the air, and the diplomat's face pales. They stammer, trying to defend themselves, but you can see the panic rising. This could push them further into silence.",
      "choices": [
        {
          "choiceId": "choice3a",
          "text": "Back off and change your approach.",
          "to": "node2"
        },
        {
          "choiceId": "choice3b",
          "text": "Threaten to escalate the situation.",
          "to": "node4",
          "effects": [
            "stat:suspicion+2"
          ]
        }
      ]
    },
    {
      "nodeId": "node4",
      "narration": "The diplomat's resolve crumbles as they reveal the name of a powerful figure involved in the blackmail. You realize this could lead to a diplomatic disaster if mishandled.",
      "choices": [
        {
          "choiceId": "choice4a",
          "text": "Use this information to negotiate.",
          "to": "node6",
          "effects": [
            "goal:interrogator.getConfession+1"
          ]
        },
        {
          "choiceId": "choice4b",
          "text": "Confront the diplomat about their involvement.",
          "to": "node5"
        }
      ]
    },
    {
      "nodeId": "node5",
      "narration": "You assure the diplomat that their safety is your priority. They seem to relax slightly, revealing more about the coercion they faced. The truth is coming to light.",
      "choices": [
        {
          "choiceId": "choice5a",
          "text": "Ask for proof of the blackmail.",
          "to": "node6"
        },
        {
          "choiceId": "choice5b",
          "text": "Suggest they come clean to the authorities.",
          "to": "node7"
        }
      ]
    }
  ],
  "endings": [
    {
      "endingId": "ending1",
      "title": "The Blackmailer Exposed",
      "type": "success",
      "narration": "With the evidence in hand, you confront the blackmailer. The truth comes out, saving the peace talks and securing the diplomat's future. You breathe a sigh of relief, knowing you made the right choice.",
      "weight": 1
    },
    {
      "endingId": "ending2",
      "title": "A Dangerous Secret",
      "type": "mixed",
      "narration": "You destroy the evidence, choosing to protect the diplomat. The blackmailer remains at large, and the peace talks hang by a thread. You wonder if you made the right decision.",
      "weight": 1
    },
    {
      "endingId": "ending3",
      "title": "The Authorities Arrive",
      "type": "success",
      "narration": "Backup arrives just in time. The diplomat's confession leads to the arrest of the blackmailer, and the peace talks are saved. You feel a sense of accomplishment.",
      "weight": 1
    },
    {
      "endingId": "ending4",
      "title": "A Risky Gamble",
      "type": "failure",
      "narration": "You handle the situation alone, but it spirals out of control. The diplomat's involvement is leaked, and the peace talks collapse. You are left to pick up the pieces.",
      "weight": 1
    },
    {
      "endingId": "node6",
      "title": "Node6",
      "type": "mixed",
      "narration": "The diplomat hands you a USB drive containing incriminating evidence. This could change everything. You weigh the risks of using this information against the potential fallout."
    },
    {
      "endingId": "node7",
      "title": "Node7",
      "type": "mixed",
      "narration": "The diplomat looks conflicted but nods. They understand the gravity of the situation. You prepare to make a call to the authorities, hoping for a resolution."
    }
  ],
  "uiHints": [],
  "themeSignals": []
}